[
  {
    "id": "session_u10_w1_s1",
    "name": "Intro to Stick Skills",
    "weekNumber": 1,
    "sessionNumber": 1,
    "ageGroup": "u10",
    "theme": "Ball Control Fundamentals",
    "duration": 60,
    "warmup": {
      "duration": 10,
      "activities": ["Jog with ball - free dribble in grid", "Dynamic stretches: high knees, butt kicks, side shuffles with stick"]
    },
    "drills": ["drill_cone_slalom", "drill_indian_dribble", "drill_push_pass_pairs"],
    "cooldown": {
      "duration": 5,
      "activities": ["Static stretches in a circle", "Ball juggling on stick (fun challenge)", "Recap: what did we learn today?"]
    },
    "coachNotes": "First session — establish routines and expectations. Focus on FUN and positive reinforcement. Don't over-correct technique yet.",
    "emotionalCues": ["encourage", "celebrate"]
  },
  {
    "id": "session_u10_w1_s2",
    "name": "Passing & Communication",
    "weekNumber": 1,
    "sessionNumber": 2,
    "ageGroup": "u10",
    "theme": "Basic Passing",
    "duration": 60,
    "warmup": {
      "duration": 10,
      "activities": ["Partner passing on the move across the grid", "Dynamic stretches with ball: lunges with push pass"]
    },
    "drills": ["drill_push_pass_pairs", "drill_lead_receive", "drill_home_wall_pass"],
    "cooldown": {
      "duration": 5,
      "activities": ["Cool-down jog", "Stretches", "Home assignment: 50 wall passes each night"]
    },
    "coachNotes": "Introduce the wall pass homework. Explain that solo practice at home builds skills faster than team sessions alone.",
    "emotionalCues": ["team_build", "encourage"]
  },
  {
    "id": "session_u10_w2_s1",
    "name": "Receiving Under Pressure",
    "weekNumber": 2,
    "sessionNumber": 1,
    "ageGroup": "u10",
    "theme": "First Touch & Turning",
    "duration": 60,
    "warmup": {
      "duration": 10,
      "activities": ["Ball mastery: toe taps, rolls, pull-backs", "Light jog with Indian dribble"]
    },
    "drills": ["drill_trap_and_turn", "drill_indian_dribble", "drill_push_pass_pairs"],
    "cooldown": {
      "duration": 5,
      "activities": ["Stretching circle", "Recap: why is first touch important?"]
    },
    "coachNotes": "Build on week 1 passing. Now focus on what happens AFTER you receive — the turn and next action.",
    "emotionalCues": ["encourage", "challenge"]
  },
  {
    "id": "session_u10_w2_s2",
    "name": "Movement & Space",
    "weekNumber": 2,
    "sessionNumber": 2,
    "ageGroup": "u10",
    "theme": "Off-Ball Movement",
    "duration": 60,
    "warmup": {
      "duration": 10,
      "activities": ["Sharks & Minnows (dribbling game)", "Dynamic movement: sprints, backpedal, lateral shuffles"]
    },
    "drills": ["drill_lead_receive", "drill_trap_and_turn", "drill_agility_ladder"],
    "cooldown": {
      "duration": 5,
      "activities": ["Cool-down lap", "Stretches", "Recap: showing for the ball"]
    },
    "coachNotes": "Concept of creating space. 'If you want the ball, move to where the ball ISN'T.' Leads and timing.",
    "emotionalCues": ["team_build", "encourage"]
  },
  {
    "id": "session_u10_w3_s1",
    "name": "Defending Fundamentals",
    "weekNumber": 3,
    "sessionNumber": 1,
    "ageGroup": "u10",
    "theme": "1v1 Defending",
    "duration": 60,
    "warmup": {
      "duration": 10,
      "activities": ["Shadow drill: mirror partner's movements", "Agility ladder quick feet"]
    },
    "drills": ["drill_jab_tackle", "drill_agility_ladder", "drill_indian_dribble"],
    "cooldown": {
      "duration": 5,
      "activities": ["Stretching", "Recap: patience in defending"]
    },
    "coachNotes": "First tackling session. Emphasize: tackle the ball, NOT the player. Patience is the #1 defensive skill.",
    "emotionalCues": ["encourage", "calm"]
  },
  {
    "id": "session_u10_w3_s2",
    "name": "Attack vs Defence",
    "weekNumber": 3,
    "sessionNumber": 2,
    "ageGroup": "u10",
    "theme": "Attacking in Overloads",
    "duration": 60,
    "warmup": {
      "duration": 10,
      "activities": ["Passing gates: pass through cones to partner", "Dynamic warm-up with ball"]
    },
    "drills": ["drill_3v2_overload", "drill_push_pass_pairs", "drill_lead_receive"],
    "cooldown": {
      "duration": 5,
      "activities": ["Cool-down", "Stretches", "Recap: using the extra player"]
    },
    "coachNotes": "Connect passing, movement, and decision-making into game-like scenarios. Celebrate creativity and teamwork over individual skill.",
    "emotionalCues": ["team_build", "celebrate"]
  },
  {
    "id": "session_u10_w4_s1",
    "name": "Shooting & Scoring",
    "weekNumber": 4,
    "sessionNumber": 1,
    "ageGroup": "u10",
    "theme": "Circle Finishing",
    "duration": 60,
    "warmup": {
      "duration": 10,
      "activities": ["Quick passing in triangles", "Dynamic stretches: lunges, leg swings"]
    },
    "drills": ["drill_circle_shooting", "drill_trap_and_turn", "drill_push_pass_pairs"],
    "cooldown": {
      "duration": 5,
      "activities": ["Stretches", "Recap: hitting the target, low and hard"]
    },
    "coachNotes": "First dedicated shooting session. Emphasize technique over power. Hit the target. Low + accurate > high + wild.",
    "emotionalCues": ["celebrate", "challenge"]
  },
  {
    "id": "session_u10_w4_s2",
    "name": "Attacking Combos",
    "weekNumber": 4,
    "sessionNumber": 2,
    "ageGroup": "u10",
    "theme": "Combining to Score",
    "duration": 60,
    "warmup": {
      "duration": 10,
      "activities": ["Dribble relay races", "Pass and move warm-up"]
    },
    "drills": ["drill_3v2_overload", "drill_circle_shooting", "drill_lead_receive"],
    "cooldown": {
      "duration": 5,
      "activities": ["Cool-down jog", "Stretches", "Recap: teamwork in attack"]
    },
    "coachNotes": "Combine all attacking skills: movement, passing, receiving, shooting. Build toward match play.",
    "emotionalCues": ["team_build", "celebrate"]
  },
  {
    "id": "session_u10_w5_s1",
    "name": "Full Skills Circuit",
    "weekNumber": 5,
    "sessionNumber": 1,
    "ageGroup": "u10",
    "theme": "Skills Consolidation",
    "duration": 60,
    "warmup": {
      "duration": 10,
      "activities": ["Free dribble with coaching challenges", "Dynamic stretches"]
    },
    "drills": ["drill_indian_dribble", "drill_jab_tackle", "drill_circle_shooting", "drill_agility_ladder"],
    "cooldown": {
      "duration": 5,
      "activities": ["Stretching", "Self-assessment: what's your best skill? What needs work?"]
    },
    "coachNotes": "Review week. Stations format — 4 stations, rotate every 8 minutes. Assess individual progress informally.",
    "emotionalCues": ["encourage", "challenge"]
  },
  {
    "id": "session_u10_w5_s2",
    "name": "Small-Sided Games",
    "weekNumber": 5,
    "sessionNumber": 2,
    "ageGroup": "u10",
    "theme": "Game Play",
    "duration": 60,
    "warmup": {
      "duration": 10,
      "activities": ["Hockey freeze tag", "Quick ball mastery"]
    },
    "drills": ["drill_freeze_tag_hockey", "drill_3v2_overload"],
    "cooldown": {
      "duration": 5,
      "activities": ["Stretching circle", "Recap: what did you do well in the games?"]
    },
    "coachNotes": "Let them play! Minimal stoppages. Coach through questions, not instructions. 'What did you see? What could you do next time?'",
    "emotionalCues": ["celebrate", "team_build"]
  },
  {
    "id": "session_u10_w6_s1",
    "name": "Match Preparation",
    "weekNumber": 6,
    "sessionNumber": 1,
    "ageGroup": "u10",
    "theme": "Match Ready Skills",
    "duration": 60,
    "warmup": {
      "duration": 10,
      "activities": ["Match warm-up routine: jog, dynamic stretches, passing pairs, shooting"]
    },
    "drills": ["drill_circle_shooting", "drill_3v2_overload", "drill_jab_tackle"],
    "cooldown": {
      "duration": 5,
      "activities": ["Stretching", "Team talk: roles and positions for the match"]
    },
    "coachNotes": "Practice the pre-match warm-up they'll use on game day. Brief positional orientation. Keep it simple: where to stand at start.",
    "emotionalCues": ["calm", "team_build"]
  },
  {
    "id": "session_u10_w6_s2",
    "name": "Game Day & Celebration",
    "weekNumber": 6,
    "sessionNumber": 2,
    "ageGroup": "u10",
    "theme": "Match Play & Review",
    "duration": 60,
    "warmup": {
      "duration": 10,
      "activities": ["Pre-match warm-up routine (from W6S1)"]
    },
    "drills": ["drill_3v2_overload"],
    "cooldown": {
      "duration": 10,
      "activities": ["Extended cool-down and reflection", "Certificate presentation / awards", "Season highlights recap", "What will you practice over the break?"]
    },
    "coachNotes": "Final session: full match play (modified rules for fun). Celebrate every player. Hand out achievement cards. Set goals for next season.",
    "emotionalCues": ["celebrate", "team_build", "encourage"]
  }
]
